{
  "schemaVersion": "1.0",
  "idea": "A governed autonomous agentic business and project environment",
  "perfectedState": "Business and child-project agents inherit verified governance, knowledge, brand, security, operational, and release controls while failures route through evidence-backed recovery and learning.",
  "canonicalSources": ["notion://canonical-ledger", "repo://main", "runtime://verified"],
  "requirements": [
    {"id":"R-CONTEXT","statement":"Acquire authoritative business and project context","evidence":["context-contract"]},
    {"id":"R-INHERIT","statement":"Child projects inherit scoped constitutional controls","evidence":["inheritance-test"]},
    {"id":"R-FAILURE","statement":"Failures route through safe diagnosis and workaround escalation","evidence":["failure-route-test"]},
    {"id":"R-PLAN","statement":"Produce an executable dependency-safe implementation plan","evidence":["plan-validator"]}
  ],
  "tasks": [
    {"id":"IDEAL-001","requirementIds":["R-CONTEXT"],"action":"Resolve canonical business and project sources","rationale":"Downstream models require authoritative inputs","owner":"context steward","surface":"Notion + repository","runtime":"authorized connector and skill runtime","capability":"idealize.context-frontier","prerequisites":[],"inputs":["idea","source locators"],"outputs":["validated context"],"permissions":["read"],"readSet":["canonical sources"],"writeSet":[],"executionClass":"READ_ONLY","phase":1,"wave":1,"parallel":false,"acceptance":"Every material claim has provenance or UNKNOWN state","evidence":["context-validation report"],"failure":"Source conflict or missing authority","branch":"IF sources conflict THEN fail closed and route to authority resolution","workaround":"Search alternate canonical surface and compare timestamps","fallback":"Preserve UNKNOWN and block dependents","rollback":"Discard derived context","escalation":"Ask source owner only after evidence routes are exhausted","downstreamUnlocks":["IDEAL-002","IDEAL-003"],"canonicalDestination":"project context canon"},
    {"id":"IDEAL-002","requirementIds":["R-INHERIT"],"action":"Compile scoped inheritance controls","rationale":"Child projects need consistent but non-global constraints","owner":"governance compiler","surface":"repository","runtime":"branch-isolated repository tooling","capability":"idealize.system-synthesis","prerequisites":["IDEAL-001"],"inputs":["validated context"],"outputs":["inheritance manifest"],"permissions":["read","write branch"],"readSet":["business constitution","project boundaries"],"writeSet":["candidate inheritance manifest"],"executionClass":"REVERSIBLE_MUTATION","phase":2,"wave":2,"parallel":true,"acceptance":"Manifest contains provenance, scope, version, and conflict rules","evidence":["schema validation","inheritance fixture"],"failure":"Authority fork or hidden global override","branch":"IF authority forks THEN stop affected branch and reconcile precedence","workaround":"Narrow inheritance scope or wrap incompatible rule","fallback":"Use explicit project-local rule with conflict recorded","rollback":"Revert candidate manifest commit","escalation":"Request owner decision for irreducible authority conflict","downstreamUnlocks":["IDEAL-004"],"canonicalDestination":"governance registry"},
    {"id":"IDEAL-003","requirementIds":["R-FAILURE"],"action":"Build failure and workaround route","rationale":"Autonomy requires bounded recovery","owner":"runtime steward","surface":"agent runtime","runtime":"skill control plane","capability":"idealize.workaround-router","prerequisites":["IDEAL-001"],"inputs":["validated context"],"outputs":["failure route"],"permissions":["read","write branch"],"readSet":["capability registry"],"writeSet":["candidate route"],"executionClass":"REVERSIBLE_MUTATION","phase":2,"wave":2,"parallel":true,"acceptance":"Retry, diagnosis, alternate capability, surface change, adaptation, escalation, and abort are explicit","evidence":["trap fixtures"],"failure":"Dead-end blocker or retry storm","branch":"IF retry repeats the same fingerprint THEN diagnose and change route","workaround":"Advance through the ordered workaround ladder","fallback":"Block only affected dependents","rollback":"Restore prior route version","escalation":"Privileged request then human decision at final boundary","downstreamUnlocks":["IDEAL-004"],"canonicalDestination":"runtime route registry"},
    {"id":"IDEAL-004","requirementIds":["R-PLAN"],"action":"Compile and validate the final implementation DAG","rationale":"The perfected model must become executable work","owner":"plan compiler","surface":"repository + project tracker","runtime":"Node >=22 plus skill runtime","capability":"idealize.plan-compiler","prerequisites":["IDEAL-002","IDEAL-003"],"inputs":["inheritance manifest","failure route"],"outputs":["the-ideal-project-plan.md","plan manifest"],"permissions":["write branch"],"readSet":["validated artifacts"],"writeSet":["plan artifacts"],"executionClass":"AGENT_EXECUTABLE","phase":3,"wave":3,"parallel":false,"acceptance":"No cycles, orphans, dangling edges, write collisions, or evidence-free tasks","evidence":["plan schema","validator output","adversarial review"],"failure":"Plan validator reports BLOCKED","branch":"IF validation is BLOCKED THEN convert every finding to a repair task and revalidate","workaround":"Re-decompose non-atomic nodes and research missing capabilities","fallback":"Emit only verified executable subset with blocked branches","rollback":"Restore prior verified plan version","escalation":"Human decision only for irreducible authority or privileged operation","downstreamUnlocks":["canonicalization"],"canonicalDestination":"the-ideal-project-plan.md"}
  ],
  "edges": [
    {"from":"IDEAL-002","to":"IDEAL-001","relation":"REQUIRES"},
    {"from":"IDEAL-003","to":"IDEAL-001","relation":"REQUIRES"},
    {"from":"IDEAL-004","to":"IDEAL-002","relation":"REQUIRES"},
    {"from":"IDEAL-004","to":"IDEAL-003","relation":"REQUIRES"},
    {"from":"IDEAL-002","to":"IDEAL-003","relation":"PARALLEL_WITH"}
  ],
  "gates": [
    {"id":"G-CONTEXT","afterWave":1,"evidence":["context-validation report"]},
    {"id":"G-SYSTEM","afterWave":2,"evidence":["inheritance fixture","trap fixtures"]},
    {"id":"G-PLAN","afterWave":3,"evidence":["validator output","adversarial review"]}
  ],
  "residualRisks": ["Live connector privileges remain environment-specific and require runtime proof"]
}
